{
    "name": "RecordWithNonRequiredValidation",
    "package": "com.boozallen.aiops.mda.pattern.record",
    "description": "Example record with non required field that has validation",
    "fields": [
      {
        "name": "integerValidation",
        "type": {
          "name": "integerWithValidation",
          "package": "com.boozallen.aiops.mda.pattern.dictionary"
        }
      },
      {
        "name": "stringValidation",
        "type": {
          "name": "stringWithValidation",
          "package": "com.boozallen.aiops.mda.pattern.dictionary"
        }
      },
      {
        "name": "stringSimple",
        "type": {
          "name": "string",
          "package": "com.boozallen.aiops.mda.pattern.dictionary"
        }
      }
    ]
  }
  