{
  "name": "Address",
  "package": "com.boozallen.aiops.mda.pattern.record",
  "description": "Address custom record",
  "fields": [
    {
      "name": "street",
      "required": true,
      "type": {
        "name": "street",
        "package": "com.boozallen.aiops.mda.pattern.dictionary"
      }
    },
    {
      "name": "city",
      "type": {
        "name": "city",
        "package": "com.boozallen.aiops.mda.pattern.dictionary"
      }
    },
    {
      "name": "zipcode",
      "type": {
        "name": "zipcode",
        "package": "com.boozallen.aiops.mda.pattern.dictionary"
      }
    },
    {
      "name": "state",
      "type": {
        "name": "state",
        "package": "com.boozallen.aiops.mda.pattern.dictionary"
      }
    }
  ]
}
