{
    "name": "UndefinedEnabledRecord",
    "package": "com.boozallen.aissemble.test",
    "description": "A record with data access defined, but dataAccess.enabled undefined",
    "dataAccess": {
        "enabled": true
    },
    "fields": [
        {
            "name": "city",
            "type": {
                "name": "alphaString",
                "package": "com.boozallen.aissemble.test.dictionary"
            }
        },
        {
            "name": "state",
            "type": {
                "name": "stateCode",
                "package": "com.boozallen.aissemble.test.dictionary"
            }
        }
    ]
}