{
  "name": "PersonWithMToOneRelation",
  "package": "com.boozallen.aiops.mda.pattern.record",
  "description": "Person custom record",
  "fields": [
    {
      "name": "customField",
      "type": {
        "name": "customType",
        "package": "com.boozallen.aiops.mda.pattern.dictionary"
      }
    }
  ],
  "relations": [
    {
      "package":"com.boozallen.aiops.mda.pattern.record",
      "multiplicity":"m-1",
      "name":"Address",
      "documentation":"Many to One Relation between Person and Address"
    }
  ]
}