{
  "name": "UndefinedDataAccessRecord",
  "package": "com.boozallen.aissemble.test",
  "description": "A record with data access undefined",
  "fields": [
    {
      "name": "city",
      "type": {
        "name": "alphaString",
        "package": "com.boozallen.aissemble.test.dictionary"
      }
    },
    {
      "name": "state",
      "type": {
        "name": "stateCode",
        "package": "com.boozallen.aissemble.test.dictionary"
      }
    }
  ],
  "dataAccess": {
    "enabled": true
  }
}
