{
  "name": "ExplicitRecord",
  "package": "com.boozallen.aissemble.test",
  "description": "A record with data access explicitly set",
  "dataAccess": {
    "enabled": false
  },
  "fields": [
    {
      "name": "city",
      "type": {
        "name": "alphaString",
        "package": "com.boozallen.aissemble.test.dictionary"
      }
    },
    {
      "name": "state",
      "type": {
        "name": "stateCode",
        "package": "com.boozallen.aissemble.test.dictionary"
      }
    }
  ]
}