{
  "name": "State",
  "package": "com.boozallen.aiops.mda.pattern.record",
  "description": "Example State record for testing Spark Java Data Relations",
  "fields": [
    {
      "name": "name",
      "type": {
        "name": "string",
        "package": "com.boozallen.aiops.mda.pattern.dictionary"
      }
    }
  ]
}
