{
  "name": "Mayor",
  "package": "com.boozallen.aiops.mda.pattern.record",
  "description": "Example Mayor record for testing Spark Java Data Relations",
  "fields": [
    {
      "name": "name",
      "type": {
        "name": "string",
        "package": "com.boozallen.aiops.mda.pattern.dictionary"
      }
    },
    {
      "name": "integerValidation",
      "type": {
        "name": "integerWithValidation",
        "package": "com.boozallen.aiops.mda.pattern.dictionary"
      },
      "column": "int_v8n"
    }
  ]
}
