{
  "name": "RecordWithRequiredValidation",
  "package": "com.boozallen.aiops.mda.pattern.record",
  "description": "Example record with a required field that has validation",
  "fields": [
    {
      "name": "integerValidation",
      "type": {
        "name": "integerWithValidation",
        "package": "com.boozallen.aiops.mda.pattern.dictionary"
      },
      "required": true
    },
    {
      "name": "stringValidation",
      "type": {
        "name": "stringWithValidation",
        "package": "com.boozallen.aiops.mda.pattern.dictionary"
      },
      "required": true
    },
    {
      "name": "stringSimple",
      "type": {
        "name": "string",
        "package": "com.boozallen.aiops.mda.pattern.dictionary"
      },
      "required": true
    }
  ]
}
